מכנסי טרנינג;84.95 ₪
סריג פולו פסים אוברסייז;169.90 ₪
סריג קרופ מסובב;0.00 ₪
חולצת PU במראה עור עם צווארון קשירה;99.50 ₪
חולצה מכופתרת דקה;199.00 ₪
פוטר קולג’ אוברסייז;0.00 ₪
פוטר בגזרה קצרה ושרוולים תפוחים;64.95 ₪
מכנסי פוטר עם כיסים;129.90 ₪
סריג פולו עם כפתורים;0.00 ₪
פוטר קפוצ’ון בייסיק;89.95 ₪
פוטר קרופ עם כיתוב;179.90 ₪
סריג כתפיים מודגשות;0.00 ₪
סריג פולו עם כפתורים;74.95 ₪
מכנסי פוטר עם כיסים;149.90 ₪
סריג וי צמות;0.00 ₪
סוודר צמות עם פאץ’;84.95 ₪
סריג פולו;169.90 ₪
סריג פולו;0.00 ₪
סריג דק עם מפתח עגול;59.90 ₪
פוטר אוברסייז עם הדפס טקסט;99.90 ₪
סריג ריב חיתוכים;0.00 ₪
פוטר בהדפס עציצי פרחים;59.90 ₪
מכנסי פוטר בגזרה גבוהה;129.90 ₪
מכנסי פוטר במראה קרגו;0.00 ₪
